{
  "schema_version": "1.0",
  "asset_id": "lesson-01-memory-symbol-mug",
  "file": "public/assets/diagrams/lesson-01-memory-symbol-mug.svg",
  "category": "diagram",
  "title": "Draw the mug you see",
  "alt_text": "A regular mug symbol with parallel body sides and a horizontal rim is contrasted with an observed mug whose rim tilt, body taper, and handle opening are checked against the real object.",
  "caption": "Compare the rim, taper, and handle opening with your mug.",
  "created_on": "2026-09-30",
  "provenance": {
    "origin": "original",
    "creator_or_model": "Codex; deterministic SVG paths authored for this course",
    "work_title": "Draw the mug you see",
    "creation_date_or_period": "2026-09-30",
    "rights_basis": "original",
    "license_or_attribution": "Original course asset. No source-book image was used."
  },
  "distribution": "deployable_after_review",
  "review_notes": "Portrait teaching diagram with large labels for phone viewing. Original example, not a target mug; review in the app before release."
}
