{
  "schema_version": "1.0",
  "asset_id": "lesson-08-cup-mistake",
  "file": "public/assets/teaching/lesson-08-cup-mistake.jpg",
  "category": "generated_example",
  "title": "Cup Mistake",
  "alt_text": "Two graphite cup drawings compare a forced vertical cylinder and guessed handle with a subtly tapered, asymmetric cup whose handle opening and attachment points have been checked. Light arrows point to the body side and handle joins.",
  "caption": "Use the construction to begin; use the cup to correct it.",
  "created_on": "2026-09-30",
  "provenance": {
    "origin": "generated",
    "creator_or_model": "OpenAI image generation tool, directed by Codex from a lesson-specific visual brief",
    "work_title": "ArtApp Lesson 08: Cup Mistake",
    "creation_date_or_period": "2026-09-30",
    "rights_basis": "generated",
    "license_or_attribution": "Original generated ArtApp instructional visual, created from an independent written brief; no source-book image was supplied or used."
  },
  "distribution": "deployable_after_review",
  "review_notes": "Original graphite-style teaching example reviewed for lesson fit. Source-book illustration page candidates are listed in docs/VISUAL_DIRECTION_AUDIT_01_09.md but were unavailable for visual inspection; this asset is not based on a viewed book image. Check readability at phone width in the rendered app."
}
