{
  "schema_version": "1.0",
  "asset_id": "lesson-01-warmup-check-one-relation",
  "file": "public/assets/teaching/lesson-01-warmup-check-one-relation.jpg",
  "category": "generated_example",
  "title": "Warmup Check One Relation",
  "alt_text": "A five-step timeline shows looking for 30 seconds, sketching for two minutes, comparing height and width, making a second two-minute sketch, and circling what changed.",
  "caption": "Keep the mug and viewpoint steady for both tiny sketches.",
  "created_on": "2026-09-30",
  "provenance": {
    "origin": "generated",
    "creator_or_model": "OpenAI image generation tool, directed by Codex from a lesson-specific visual brief",
    "work_title": "ArtApp Lesson 01: Warmup Check One Relation",
    "creation_date_or_period": "2026-09-30",
    "rights_basis": "generated",
    "license_or_attribution": "Original generated ArtApp instructional visual, created from an independent written brief; no source-book image was supplied or used."
  },
  "distribution": "deployable_after_review",
  "review_notes": "Original graphite-style teaching example reviewed for lesson fit. Source-book illustration page candidates are listed in docs/VISUAL_DIRECTION_AUDIT_01_09.md but were unavailable for visual inspection; this asset is not based on a viewed book image. Check readability at phone width in the rendered app."
}
