{
  "schema_version": "1.0",
  "asset_id": "lesson-09-ellipse-mistake",
  "file": "public/assets/teaching/lesson-09-ellipse-mistake.jpg",
  "category": "generated_example",
  "title": "Ellipse Mistake",
  "alt_text": "The same oval copied for low and high views is contrasted with a pointed, tilted rim and a balanced ellipse checked against a center axis.",
  "caption": "Compare each half across the center axis, then check the opening against life.",
  "created_on": "2026-09-30",
  "provenance": {
    "origin": "generated",
    "creator_or_model": "OpenAI image generation tool, directed by Codex from a lesson-specific visual brief",
    "work_title": "ArtApp Lesson 09: Ellipse Mistake",
    "creation_date_or_period": "2026-09-30",
    "rights_basis": "generated",
    "license_or_attribution": "Original generated ArtApp instructional visual, created from an independent written brief; no source-book image was supplied or used."
  },
  "distribution": "deployable_after_review",
  "review_notes": "Original graphite-style teaching example reviewed for lesson fit. Source-book illustration page candidates are listed in docs/VISUAL_DIRECTION_AUDIT_01_09.md but were unavailable for visual inspection; this asset is not based on a viewed book image. Check readability at phone width in the rendered app."
}
