{
  "schema_version": "1.0",
  "asset_id": "lesson-06-crop-thumbnails-exercise",
  "file": "public/assets/teaching/lesson-06-crop-thumbnails-exercise.jpg",
  "category": "generated_example",
  "title": "Crop Thumbnails Exercise",
  "alt_text": "A single graphite mug-and-book arrangement is overlaid by three differently styled crop rectangles. The objects keep the same scale and placement while each page boundary changes the crop.",
  "caption": "Compare big shapes and gaps before adding identifying details.",
  "created_on": "2026-09-30",
  "provenance": {
    "origin": "generated",
    "creator_or_model": "OpenAI image generation tool, directed by Codex from a lesson-specific visual brief",
    "work_title": "ArtApp Lesson 06: Crop Thumbnails Exercise",
    "creation_date_or_period": "2026-09-30",
    "rights_basis": "generated",
    "license_or_attribution": "Original generated ArtApp instructional visual, created from an independent written brief; no source-book image was supplied or used."
  },
  "distribution": "deployable_after_review",
  "review_notes": "Original graphite-style teaching example reviewed for lesson fit. Source-book illustration page candidates are listed in docs/VISUAL_DIRECTION_AUDIT_01_09.md but were unavailable for visual inspection; this asset is not based on a viewed book image. Check readability at phone width in the rendered app."
}
