{
  "schema_version": "1.0",
  "asset_id": "core-003-reference",
  "file": "public/assets/references/core-003-reference.png",
  "category": "generated_reference",
  "title": "Core 003 pear fixed-view reference",
  "alt_text": "A single pear with a short stem rests upright on a tabletop in a fixed close three-quarter view, with its full outside boundary and base contact visible against a plain background.",
  "caption": "Fallback reference. Use the same view throughout the drawing.",
  "created_on": "2026-10-01",
  "provenance": {
    "origin": "generated",
    "creator_or_model": "OpenAI built-in image_gen; model/version not exposed by the tool",
    "creation_date_or_period": "2026-10-01",
    "rights_basis": "generated",
    "license_or_attribution": "Original AI-generated reference; no external image or illustration used."
  },
  "distribution": "deployable_after_review",
  "review_notes": "Group A independent image review dated 2026-10-01: PASS. At 360 px wide, the pear and short stem remain fully visible in a stable close three-quarter view; the outside boundary and tabletop contact are clear."
}
