{
  "schema_version": "1.0",
  "asset_id": "lesson-03-gap-first-plant-study",
  "file": "public/assets/teaching/lesson-03-gap-first-plant-study.jpg",
  "category": "generated_example",
  "title": "Gap First Plant Study",
  "alt_text": "A potted plant study shows outer page limits, three lightly highlighted gaps around and between leaves, and arrows from the gaps toward the neighboring plant edges they help locate.",
  "caption": "Block in a few large gaps, then use their edges to place nearby forms.",
  "created_on": "2026-09-30",
  "provenance": {
    "origin": "generated",
    "creator_or_model": "OpenAI image generation tool, directed by Codex from a lesson-specific visual brief",
    "work_title": "ArtApp Lesson 03: Gap First Plant Study",
    "creation_date_or_period": "2026-09-30",
    "rights_basis": "generated",
    "license_or_attribution": "Original generated ArtApp instructional visual, created from an independent written brief; no source-book image was supplied or used."
  },
  "distribution": "deployable_after_review",
  "review_notes": "Original graphite-style teaching example reviewed for lesson fit. Source-book illustration page candidates are listed in docs/VISUAL_DIRECTION_AUDIT_01_09.md but were unavailable for visual inspection; this asset is not based on a viewed book image. Check readability at phone width in the rendered app."
}
