{
  "schema_version": "1.0",
  "asset_id": "lesson-05-search-and-select-lines",
  "file": "public/assets/teaching/lesson-05-search-and-select-lines.jpg",
  "category": "generated_example",
  "title": "Search And Select Lines",
  "alt_text": "Three hand-drawn book outlines progress from pale overlapping search strokes, to a checked contour, to three selected firmer edges while other edges remain light.",
  "caption": "A clear line records a check; it does not have to outline everything.",
  "created_on": "2026-09-30",
  "provenance": {
    "origin": "generated",
    "creator_or_model": "OpenAI image generation tool, directed by Codex from a lesson-specific visual brief",
    "work_title": "ArtApp Lesson 05: Search And Select Lines",
    "creation_date_or_period": "2026-09-30",
    "rights_basis": "generated",
    "license_or_attribution": "Original generated ArtApp instructional visual, created from an independent written brief; no source-book image was supplied or used."
  },
  "distribution": "deployable_after_review",
  "review_notes": "Original graphite-style teaching example reviewed for lesson fit. Source-book illustration page candidates are listed in docs/VISUAL_DIRECTION_AUDIT_01_09.md but were unavailable for visual inspection; this asset is not based on a viewed book image. Check readability at phone width in the rendered app."
}
