{
  "schema_version": "1.0",
  "asset_id": "core-005-reference",
  "file": "public/assets/references/core-005-reference.png",
  "category": "generated_reference",
  "title": "Core Drawing 005 — fixed side-view shoe reference",
  "alt_text": "A plain, unbranded low-top shoe is shown in a complete level side profile on a quiet neutral surface, with its toe, heel, upper edge, and full sole visible.",
  "caption": "Fallback view for the first contour study. Keep the shoe in this side view while you compare.",
  "created_on": "2026-10-01",
  "provenance": {
    "origin": "generated",
    "creator_or_model": "Codex built-in image_gen; model/version not exposed in the tool result",
    "creation_date_or_period": "2026-10-01",
    "rights_basis": "generated",
    "license_or_attribution": "Original AI-generated image; no external images or source materials were used."
  },
  "distribution": "deployable_after_review",
  "review_notes": "Group B independent image review dated 2026-10-01: PASS. The complete plain low-top shoe, toe, heel, upper edge, and full sole are plausible and readable at 360 pixels wide. Alt and caption match the level side-profile image."
}
